{
  "captured_at": "2026-09-15T20:53:52+00:00",
  "global_intent_association": {
    "corpus_majority_family_baseline": 0.735714,
    "cramers_v": 0.312571,
    "normalized_excess_consistency": 0.0,
    "normalized_mutual_information": 0.085667,
    "within_intent_family_consistency": 0.735714
  },
  "intent_profiles": [
    {
      "assessment_status": "scored",
      "association_lift": 0.849515,
      "cohort_size": 8,
      "corpus_family_baseline": 0.735714,
      "dominant_family_id": "ave_family_02",
      "dominant_family_label": "Persistent shared-carrier modulation",
      "family_consistency": 0.625,
      "family_distribution": [
        {
          "count": 2,
          "family_id": "ave_family_01",
          "family_label": "Persistent shared-carrier modulation",
          "proportion": 0.25
        },
        {
          "count": 5,
          "family_id": "ave_family_02",
          "family_label": "Persistent shared-carrier modulation",
          "proportion": 0.625
        },
        {
          "count": 1,
          "family_id": "ave_family_03",
          "family_label": "Persistent detuned-carrier modulation",
          "proportion": 0.125
        }
      ],
      "normalized_excess_consistency": -0.150485,
      "stated_intent": "chill"
    },
    {
      "assessment_status": "scored",
      "association_lift": 1.165049,
      "cohort_size": 14,
      "corpus_family_baseline": 0.735714,
      "dominant_family_id": "ave_family_02",
      "dominant_family_label": "Persistent shared-carrier modulation",
      "family_consistency": 0.857143,
      "family_distribution": [
        {
          "count": 2,
          "family_id": "ave_family_01",
          "family_label": "Persistent shared-carrier modulation",
          "proportion": 0.142857
        },
        {
          "count": 12,
          "family_id": "ave_family_02",
          "family_label": "Persistent shared-carrier modulation",
          "proportion": 0.857143
        },
        {
          "count": 0,
          "family_id": "ave_family_03",
          "family_label": "Persistent detuned-carrier modulation",
          "proportion": 0.0
        }
      ],
      "normalized_excess_consistency": 0.459459,
      "stated_intent": "creativity"
    },
    {
      "assessment_status": "scored",
      "association_lift": 0.86496,
      "cohort_size": 11,
      "corpus_family_baseline": 0.735714,
      "dominant_family_id": "ave_family_02",
      "dominant_family_label": "Persistent shared-carrier modulation",
      "family_consistency": 0.636364,
      "family_distribution": [
        {
          "count": 0,
          "family_id": "ave_family_01",
          "family_label": "Persistent shared-carrier modulation",
          "proportion": 0.0
        },
        {
          "count": 7,
          "family_id": "ave_family_02",
          "family_label": "Persistent shared-carrier modulation",
          "proportion": 0.636364
        },
        {
          "count": 4,
          "family_id": "ave_family_03",
          "family_label": "Persistent detuned-carrier modulation",
          "proportion": 0.363636
        }
      ],
      "normalized_excess_consistency": -0.13504,
      "stated_intent": "deep_sleep"
    },
    {
      "assessment_status": "scored",
      "association_lift": 0.941001,
      "cohort_size": 13,
      "corpus_family_baseline": 0.735714,
      "dominant_family_id": "ave_family_02",
      "dominant_family_label": "Persistent shared-carrier modulation",
      "family_consistency": 0.692308,
      "family_distribution": [
        {
          "count": 1,
          "family_id": "ave_family_01",
          "family_label": "Persistent shared-carrier modulation",
          "proportion": 0.076923
        },
        {
          "count": 9,
          "family_id": "ave_family_02",
          "family_label": "Persistent shared-carrier modulation",
          "proportion": 0.692308
        },
        {
          "count": 3,
          "family_id": "ave_family_03",
          "family_label": "Persistent detuned-carrier modulation",
          "proportion": 0.230769
        }
      ],
      "normalized_excess_consistency": -0.058999,
      "stated_intent": "deep_work"
    },
    {
      "assessment_status": "scored",
      "association_lift": 0.815534,
      "cohort_size": 5,
      "corpus_family_baseline": 0.735714,
      "dominant_family_id": "ave_family_02",
      "dominant_family_label": "Persistent shared-carrier modulation",
      "family_consistency": 0.6,
      "family_distribution": [
        {
          "count": 0,
          "family_id": "ave_family_01",
          "family_label": "Persistent shared-carrier modulation",
          "proportion": 0.0
        },
        {
          "count": 3,
          "family_id": "ave_family_02",
          "family_label": "Persistent shared-carrier modulation",
          "proportion": 0.6
        },
        {
          "count": 2,
          "family_id": "ave_family_03",
          "family_label": "Persistent detuned-carrier modulation",
          "proportion": 0.4
        }
      ],
      "normalized_excess_consistency": -0.184466,
      "stated_intent": "destress"
    },
    {
      "assessment_status": "scored",
      "association_lift": 1.223301,
      "cohort_size": 10,
      "corpus_family_baseline": 0.735714,
      "dominant_family_id": "ave_family_02",
      "dominant_family_label": "Persistent shared-carrier modulation",
      "family_consistency": 0.9,
      "family_distribution": [
        {
          "count": 0,
          "family_id": "ave_family_01",
          "family_label": "Persistent shared-carrier modulation",
          "proportion": 0.0
        },
        {
          "count": 9,
          "family_id": "ave_family_02",
          "family_label": "Persistent shared-carrier modulation",
          "proportion": 0.9
        },
        {
          "count": 1,
          "family_id": "ave_family_03",
          "family_label": "Persistent detuned-carrier modulation",
          "proportion": 0.1
        }
      ],
      "normalized_excess_consistency": 0.621622,
      "stated_intent": "guided"
    },
    {
      "assessment_status": "scored",
      "association_lift": 1.057174,
      "cohort_size": 9,
      "corpus_family_baseline": 0.735714,
      "dominant_family_id": "ave_family_02",
      "dominant_family_label": "Persistent shared-carrier modulation",
      "family_consistency": 0.777778,
      "family_distribution": [
        {
          "count": 0,
          "family_id": "ave_family_01",
          "family_label": "Persistent shared-carrier modulation",
          "proportion": 0.0
        },
        {
          "count": 7,
          "family_id": "ave_family_02",
          "family_label": "Persistent shared-carrier modulation",
          "proportion": 0.777778
        },
        {
          "count": 2,
          "family_id": "ave_family_03",
          "family_label": "Persistent detuned-carrier modulation",
          "proportion": 0.222222
        }
      ],
      "normalized_excess_consistency": 0.159159,
      "stated_intent": "guided_sleep"
    },
    {
      "assessment_status": "scored",
      "association_lift": 1.132686,
      "cohort_size": 12,
      "corpus_family_baseline": 0.735714,
      "dominant_family_id": "ave_family_02",
      "dominant_family_label": "Persistent shared-carrier modulation",
      "family_consistency": 0.833333,
      "family_distribution": [
        {
          "count": 2,
          "family_id": "ave_family_01",
          "family_label": "Persistent shared-carrier modulation",
          "proportion": 0.166667
        },
        {
          "count": 10,
          "family_id": "ave_family_02",
          "family_label": "Persistent shared-carrier modulation",
          "proportion": 0.833333
        },
        {
          "count": 0,
          "family_id": "ave_family_03",
          "family_label": "Persistent detuned-carrier modulation",
          "proportion": 0.0
        }
      ],
      "normalized_excess_consistency": 0.369369,
      "stated_intent": "learning"
    },
    {
      "assessment_status": "scored",
      "association_lift": 0.906149,
      "cohort_size": 6,
      "corpus_family_baseline": 0.735714,
      "dominant_family_id": "ave_family_02",
      "dominant_family_label": "Persistent shared-carrier modulation",
      "family_consistency": 0.666667,
      "family_distribution": [
        {
          "count": 2,
          "family_id": "ave_family_01",
          "family_label": "Persistent shared-carrier modulation",
          "proportion": 0.333333
        },
        {
          "count": 4,
          "family_id": "ave_family_02",
          "family_label": "Persistent shared-carrier modulation",
          "proportion": 0.666667
        },
        {
          "count": 0,
          "family_id": "ave_family_03",
          "family_label": "Persistent detuned-carrier modulation",
          "proportion": 0.0
        }
      ],
      "normalized_excess_consistency": -0.093851,
      "stated_intent": "light_work"
    },
    {
      "assessment_status": "scored",
      "association_lift": 0.970874,
      "cohort_size": 7,
      "corpus_family_baseline": 0.735714,
      "dominant_family_id": "ave_family_02",
      "dominant_family_label": "Persistent shared-carrier modulation",
      "family_consistency": 0.714286,
      "family_distribution": [
        {
          "count": 1,
          "family_id": "ave_family_01",
          "family_label": "Persistent shared-carrier modulation",
          "proportion": 0.142857
        },
        {
          "count": 5,
          "family_id": "ave_family_02",
          "family_label": "Persistent shared-carrier modulation",
          "proportion": 0.714286
        },
        {
          "count": 1,
          "family_id": "ave_family_03",
          "family_label": "Persistent detuned-carrier modulation",
          "proportion": 0.142857
        }
      ],
      "normalized_excess_consistency": -0.029126,